{
  "nav": {
    "home": "Home",
    "settings": "Settings",
    "about": "About",
    "charging": "Charging",
    "network": "Network",
    "serial": "Serial",
    "modbus": "Modbus",
    "scheduler": "Scheduler",
    "files": "Files",
    "script": "Script",
    "management": "Management",
    "system": "System",
    "nextion": "Nextion",
    "selectLanguage": "Select language",
    "toggleTheme": "Toggle theme"
  },
  "pendingAuthorization": "Pending authorization",
  "chargingLimitReached": "Charging limit reached",
  "evConnected": "EV connected",
  "charging": "Charging",
  "error": "Error",
  "notAvailable": "Not available",
  "evNotConnected": "EV not connected",
  "sessionTime": "Session time",
  "chargingTime": "Charging time",
  "power": "Power",
  "consumption": "Consumption",
  "totalConsumption": "Total consumption",
  "resetTotalConsumption": "Reset total consumption",
  "confirmResetTotalConsumption": "Reset total consumption?",
  "enabled": "Enabled",
  "authorize": "Authorize",
  "sessionLimit": "Session limit",
  "underPower": "Under power",
  "none": "None",
  "$none": "none",
  "yes": "Yes",
  "no": "No",
  "submit": "Submit",
  "reset": "Reset",
  "reload": "Reload",
  "cancel": "Cancel",
  "status": "Status",
  "deviceInfo": "Device info",
  "uptime": "Uptime",
  "temperature": "Temperature",
  "temperatureSensorCount": "Temperature sensor count",
  "version": "Version",
  "dateOfBuild": "Date of build",
  "idfVersion": "IDF version",
  "ip": "IP",
  "mac": "Mac",
  "chip": "Chip",
  "chipCores": "Chip cores",
  "chipRevision": "Chip revision",
  "heap": "Heap",
  "moreDetails": "More details",
  "free": "Free",
  "allocated": "Allocated",
  "largestFreeBlock": "Largest free block",
  "minFree": "Minimum free",
  "deviceName": "Device name",
  "proximity": "Proximity pilot",
  "socketLock": "Socket lock",
  "rcm": "Residual current monitor",
  "energyMeter": "Energy meter",
  "energyMeterThreePhases": "Three phase energy meter",
  "auxInputs": "AUX inputs",
  "auxOutputs": "AUX outputs",
  "auxAnalogInputs": "AUX analog inputs",
  "serials": "Serial ports",
  "maxChargingCurrent": "Max charging current",
  "chargingCurrent": "Charging current",
  "consumptionLimit": "Consumption limit",
  "chargingTimeLimit": "Charging time limit",
  "underPowerLimit": "Under power limit",
  "requireAuth": "Require authorization",
  "socketOutlet": "Socket outlet",
  "temperatureThreshold": "Temperature threshold",
  "operatingTime": "Operating time",
  "breakTime": "Break time",
  "retryCount": "Retry count",
  "detection": "Detection",
  "unlockedHigh": "Unlocked high",
  "lockedHigh": "Locked high",
  "mode": "Mode",
  "dummy": "Dummy",
  "currentSensing": "Current sensing",
  "currentAndVoltageSensing": "Current and voltage sensing",
  "acVoltage": "AC voltage",
  "threePhases": "Three phases",
  "ssid": "SSID",
  "user": "User",
  "password": "Password",
  "loading": "Loading...",
  "uploading": "Uploading...",
  "noWifiFound": "No WiFi found",
  "systemLogs": "System logs",
  "modbus": "Modbus",
  "nextionDisplay": "Nextion display",
  "script": "Script",
  "atCommands":"AT commands",
  "baudRate": "Baud rate",
  "dataBits": "Data bits",
  "stopBits": "Stop bits",
  "parity": "Parity",
  "disable": "Disable",
  "even": "Even",
  "odd": "Odd",
  "tcpServer": "TCP server",
  "unitId": "Unit ID",
  "timezone": "Timezone",
  "time": "Time",
  "setCurrent": "Set current",
  "ntp": "NTP",
  "serverFromDhcp": "Server from DHCP",
  "server": "Server",
  "schedules": "Schedules",
  "noSchedules": "No schedules",
  "addSchedule": "Add schedule",
  "action": "Action",
  "enableCharging": "Enable charging",
  "chargerAvailable": "Charger available",
  "chargingCurrent6A": "Charging current 6A",
  "chargingCurrent8A": "Charging current 8A",
  "chargingCurrent10A": "Charging current 10A",
  "clear": "Clear",
  "remove": "Remove",
  "monday": "Mon",
  "tuesday": "Tue",
  "wednesday": "Wed",
  "thursday": "Thu",
  "friday": "Fri",
  "saturday": "Sat",
  "sunday": "Sun",
  "root": "Root",
  "name": "Name",
  "size": "Size",
  "download": "Download",
  "edit": "Edit",
  "_delete": "Delete",
  "emptyDirectory": "Directory is empty",
  "createDirectory": "Create directory",
  "createFile": "Create file",
  "uploadFile": "Upload file",
  "fileName": "File name",
  "directoryName": "Directory name",
  "fileContent": "File content",
  "fileSaved": "File saved",
  "directorySaved": "Directory saved",
  "fileDeleted": "File was deleted",
  "directoryDeleted": "Directory was deleted",
  "fileUploaded": "File was successfully uploaded",
  "fileTooLarge": "Selected file is to large",
  "components": "Components",
  "noComponents": "No script components",
  "configuration": "Configuration",
  "noComponentConfig": "Component has no configuration",
  "autoReload": "Auto reload",
  "output": "Output",
  "restart": "Restart",
  "confirmRestart": "Restart device?",
  "firmware": "Firmware",
  "channel": "Channel",
  "checkForUpdate": "Check for update",
  "upgradeTo": "Upgrade to",
  "noUpdateAvailable": "No update available",
  "uploadFirmware": "Upload firmware",
  "binariesFromReleases1": "use OTA binaries from",
  "binariesFromReleases2": "releases",
  "writeFirmware": "Write firmware",
  "willBeRestart": "Device will be restated",
  "reloadInSeconds1": "Reload in",
  "reloadInSeconds2": "seconds",
  "reloadNow": "Reload now",
  "successfullyUpdatedFirmware": "Firmware successfully updated",
  "successfullyUpdated": "Successfully updated",
  "scriptReloaded": "Script was reloaded",
  "networkError": "Network error",
  "reloadPage": "Reload page",
  "model": "Model",
  "touch": "Touch",
  "flashSize": "Flash size",
  "noNextionConnected": "No Nextion display connected",
  "uploadProgram": "Upload program",
  "writeProgram": "Write program",
  "staticIp": "Static IP address",
  "gateway": "Gateway",
  "netmask": "Netmask",
  "dns": "DNS server",
  "wifiAccessPoint": "WiFi AP",
  "wifiAccessPointAutoStop": "The access point will automatically shut down if no one connects to it within one minute.",
  "wifiStation": "WiFi station",
  "discovery": "Discovery",
  "hostname": "Hostname",
  "instanceName": "Instance name",
  "rssi": "RSSI",
  "panicReboot": "Panic reboot",
  "acknowledge": "Acknowledge",
  "successfullyAcknowledged": "Successfully acknowledged",
  "httpErrorValues": {
    "400": "Bad request",
    "404": "Not found",
    "413": "Content too large",
    "415": "Unsupported media type",
    "500": "Internal server error",
    "512": "Failed to allocate memory",
    "513": "Failed to receive request",
    "520": "Cannot fetch latest version info",
    "521": "Failed to upgrade firmware",
    "522": "Failed to receive firmware",
    "523": "Invalid firmware file",
    "531": "Failed to write program",
    "532": "Failed to receive program"
  },
  "errorValues": {
    "pilot_fault": "Pilot fault",
    "diode_short": "Diode short",
    "lock_fault": "Lock fault",
    "unlock_fault": "Unlock fault",
    "rcm_triggered": "RCM triggered",
    "rcm_selftest_fault": "RCM selftest fault",
    "temperature_high": "High temperature",
    "temperature_fault": "Temperature sensor fault"
  },
  "energyMeterValues": {
    "cur_vlt": "Current and voltage",
    "cur": "Current",
    "none": "None"
  }
}