{
  "nav": {
    "home": "Домой",
    "settings": "Установки",
    "about": "О программе",
    "charging": "Зарядка",
    "network": "Network",
    "serial": "Serial",
    "modbus": "Modbus",
    "scheduler": "Планировщик",
    "files": "Файлы",
    "script": "Сценарий",
    "management": "Управление",
    "system": "Система",
    "nextion": "Nextion",
    "selectLanguage": "Выбор языка",
    "toggleTheme": "Сменить тему"
  },
  "pendingAuthorization": "Необходима авторизация",
  "chargingLimitReached": "Достигнут лимит зарядки",
  "evConnected": "Подключено к авто",
  "charging": "Зарядка",
  "error": "Ошибка",
  "notAvailable": "Невозможно",
  "evNotConnected": "Не подключено к авто",
  "sessionTime": "Время сессии",
  "chargingTime": "Время зарядки",
  "power": "Мощность",
  "consumption": "Потребление",
  "totalConsumption": "Общее потребление",
  "resetTotalConsumption": "Сброс общего потребление",
  "confirmResetTotalConsumption": "Сбросить общее потребление?",
  "enabled": "Включено",
  "authorize": "Авторизация",
  "sessionLimit": "Лимит сессии",
  "underPower": "Низкое потребление",
  "none": "Нет",
  "$none": "нет",
  "yes": "Да",
  "no": "Нет",
  "submit": "Подтвердить",
  "reset": "Сброс",
  "reload": "Обновить",
  "cancel": "Отмена",
  "status": "Статус",
  "deviceInfo": "Информация об устройстве",
  "uptime": "Время работы",
  "temperature": "Температура",
  "temperatureSensorCount": "Число термодатчиков",
  "version": "Версия",
  "dateOfBuild": "Дата сборки",
  "idfVersion": "Версия IDF",
  "ip": "IP",
  "mac": "Mac",
  "chip": "Чип",
  "chipCores": "Число ядер",
  "chipRevision": "Ревизия чипа",
  "heap": "Heap",
  "moreDetails": "Подробнее",
  "free": "Свободно",
  "allocated": "Выделено",
  "largestFreeBlock": "Наибольший свободный блок",
  "minFree": "Минимум свободно",
  "deviceName": "Имя устройства",
  "proximity": "Сигнал PP(Proximity)",
  "socketLock": "Блокировка розетки",
  "rcm": "Монитор УЗО",
  "energyMeter": "Счетчик энергии",
  "energyMeterThreePhases": "Трехфазный счетчик энергии",
  "auxInputs": "AUX входы",
  "auxOutputs": "AUX выходы",
  "auxAnalogInputs": "AUX аналоговые входы",
  "serials": "Serial порты",
  "maxChargingCurrent": "Макс. ток зарядки",
  "chargingCurrent": "Ток зарядки",
  "consumptionLimit": "Лимит потребления",
  "chargingTimeLimit": "Лимит времени зарядки",
  "underPowerLimit": "Лимит минимального потребления",
  "requireAuth": "Требуется авторизация",
  "socketOutlet": "Розетка",
  "temperatureThreshold": "Температурный порог",
  "operatingTime": "Время работы",
  "breakTime": "Время перерыва",
  "retryCount": "Число повторов",
  "detection": "Обнаружение",
  "unlockedHigh": "Разблокировано высокое напр.",
  "lockedHigh": "Заблокировано высокое напр.",
  "mode": "Режим",
  "dummy": "Пусто",
  "currentSensing": "Измерение тока",
  "currentAndVoltageSensing": "Измерение напряжения и тока",
  "acVoltage": "AC напряжение",
  "threePhases": "Три фазы",
  "ssid": "SSID",
  "user": "User",
  "password": "Password",
  "loading": "Загрузка...",
  "uploading": "Загрузка...",
  "noWifiFound": "Не найдено WiFi",
  "systemLogs": "Системный журнал",
  "modbus": "Modbus",
  "nextionDisplay": "Nextion display",
  "script": "Сценарий",
  "atCommands":"AT команды",
  "baudRate": "Baud rate",
  "dataBits": "Data bits",
  "stopBits": "Stop bits",
  "parity": "Parity",
  "disable": "Выключен",
  "even": "Even",
  "odd": "Odd",
  "tcpServer": "TCP server",
  "unitId": "ID-устройства",
  "timezone": "Часовой пояс",
  "time": "Время",
  "setCurrent": "Установить текущее",
  "ntp": "NTP",
  "serverFromDhcp": "Сервер от DHCP",
  "server": "Сервер",
  "schedules": "Сценарии",
  "noSchedules": "Нет сценариев",
  "addSchedule": "Добавить сценарий",
  "action": "Действие",
  "enableCharging": "Включить зарядку",
  "chargerAvailable": "Зарядное устройство доступно",
  "chargingCurrent6A": "Ток зарядки 6A",
  "chargingCurrent8A": "Ток зарядки 8A",
  "chargingCurrent10A": "Ток зарядки 10A",
  "clear": "Очистить",
  "remove": "Удалить",
  "monday": "Пнд",
  "tuesday": "Втр",
  "wednesday": "Срд",
  "thursday": "Чтв",
  "friday": "Пят",
  "saturday": "Суб",
  "sunday": "Вск",
  "root": "Корень",
  "name": "Имя",
  "size": "Размер",
  "download": "Скачать",
  "edit": "Редактировать",
  "_delete": "Удалить",
  "emptyDirectory": "Папка пуста",
  "createDirectory": "Создать папку",
  "createFile": "Создать файл",
  "uploadFile": "Загрузить файл",
  "fileName": "Имя файла",
  "directoryName": "Имя папки",
  "fileContent": "Содержимое файла",
  "fileSaved": "Файл записан",
  "directorySaved": "Папка записана",
  "fileDeleted": "Файл удалён",
  "directoryDeleted": "Папка удалена",
  "fileUploaded": "Файл успешно загружен",
  "fileTooLarge": "Выбранный файл слишком большой",
  "components": "Компоненты",
  "noComponents": "Нет компонентов скрипта",
  "configuration": "Конфигурация",
  "noComponentConfig": "Компонент не имеет конфигурации",
  "autoReload": "Автозагрузка",
  "output": "Выход",
  "restart": "Рестарт",
  "confirmRestart": "Перегрузить устройство?",
  "firmware": "Прошивка",
  "channel": "Канал",
  "checkForUpdate": "Проверить наличие обновлений",
  "upgradeTo": "Обновить до",
  "noUpdateAvailable": "Нет обновлений",
  "uploadFirmware": "Загрузка прошивки",
  "binariesFromReleases1": "Использовать OTA файлы",
  "binariesFromReleases2": "релизы",
  "writeFirmware": "Записать прошивку",
  "willBeRestart": "Устройство перезапущено",
  "reloadInSeconds1": "Перегрузить  через",
  "reloadInSeconds2": "секунд",
  "reloadNow": "Перегрузить сейчас",
  "successfullyUpdatedFirmware": "Прошивка обновлена успешно",
  "successfullyUpdated": "Обновление успешно",
  "scriptReloaded": "Скрипт был перезагружен",
  "networkError": "Ошибка сети",
  "reloadPage": "Обновить страницу",
  "model": "Модель",
  "touch": "Сенсор",
  "flashSize": "Размер Flash",
  "noNextionConnected": "Не подключен Nextion дисплей",
  "uploadProgram": "Загрузить программу",
  "writeProgram": "Записать программу",
  "staticIp": "Статический IP-адрес",
  "gateway": "Шлюз",
  "netmask": "Маска подсети",
  "dns": "DNS-сервер",
  "wifiAccessPoint": "Точка доступа WiFi",
  "wifiAccessPointAutoStop": "Точка доступа автоматически отключится, если в течение одной минуты к ней никто не подключится.",
  "wifiStation": "WiFi-станция",
  "discovery": "Обнаружение",
  "hostname": "Имя хоста",
  "instanceName": "Имя экземпляра",
  "rssi": "RSSI",
  "panicReboot": "Паника перезагрузка",
  "acknowledge": "Подтвердить",
  "successfullyAcknowledged": "Успешно подтверждено",
  "httpErrorValues": {
    "400": "Ошибка запроса",
    "404": "Не найдено",
    "413": "Слишком большой размер контента",
    "415": "Неподдерживаемый тип носителя",
    "500": "Внутренняя ошибка сервера",
    "512": "Не удалось выделить память",
    "513": "Не удалось получить запрос",
    "520": "Невозможно получить информацию о последней версии",
    "521": "Не удалось обновить прошивку",
    "522": "Не удалось получить прошивку",
    "523": "Неверный файл прошивки",
    "531": "Не удалось написать программу",
    "532": "Не удалось получить программу"
  },
  "errorValues": {
    "pilot_fault": "Сбой Пилот-Сигнала",
    "diode_short": "Пробой диода",
    "lock_fault": "Ошибка блокировки",
    "unlock_fault": "Ошибка разблокировки",
    "rcm_triggered": "Сработка УЗО",
    "rcm_selftest_fault": "Сбой УЗО",
    "temperature_high": "Перегрев",
    "temperature_fault": "Сбой термодатчика"
  },
  "energyMeterValues": {
    "cur_vlt": "Ток и напряжение",
    "cur": "Ток",
    "none": "Нет"
  }
}