{
  "nav": {
    "home": "Accueil",
    "settings": "Paramètres",
    "about": "À propos",
    "charging": "Recharge",
    "network": "Network",
    "serial": "Série",
    "modbus": "Modbus",
    "scheduler": "Planificateur",
    "files": "Fichiers",
    "script": "Script",
    "management": "Gestion",
    "system": "Système",
    "nextion": "Nextion",
    "selectLanguage": "Choisir la langue",
    "toggleTheme": "Changer de thème"
  },
  "pendingAuthorization": "Autorisation en attente",
  "chargingLimitReached": "Limite de recharge atteinte",
  "evConnected": "Véhicule connecté",
  "charging": "Recharge en cours",
  "error": "Erreur",
  "notAvailable": "Non disponible",
  "evNotConnected": "Véhicule non connecté",
  "sessionTime": "Durée de la session",
  "chargingTime": "Temps de recharge",
  "power": "Puissance",
  "consumption": "Consommation",
  "totalConsumption": "Consommation totale",
  "resetTotalConsumption": "Réinitialiser consommation totale",
  "confirmResetTotalConsumption": "Réinitialiser consommation totale ?",
  "enabled": "Activé",
  "authorize": "Autoriser",
  "sessionLimit": "Limite de session",
  "underPower": "Sous-alimentation",
  "none": "Aucun",
  "$none": "aucun",
  "yes": "Oui",
  "no": "Non",
  "submit": "Valider",
  "reset": "Réinitialiser",
  "reload": "Recharger",
  "cancel": "Annuler",
  "status": "Statut",
  "deviceInfo": "Informations sur l'appareil",
  "uptime": "Temps de fonctionnement",
  "temperature": "Température",
  "temperatureSensorCount": "Nombre de capteurs de température",
  "version": "Version",
  "dateOfBuild": "Date de compilation",
  "idfVersion": "Version IDF",
  "ip": "IP",
  "mac": "Adresse MAC",
  "chip": "Puce",
  "chipCores": "Noyaux de la puce",
  "chipRevision": "Révision de la puce",
  "heap": "Mémoire disponible",
  "moreDetails": "Plus de détails",
  "free": "Libre",
  "allocated": "Alloué",
  "largestFreeBlock": "Plus grand bloc libre",
  "minFree": "Minimum libre",
  "deviceName": "Nom de l'appareil",
  "proximity": "Pilote de proximité",
  "socketLock": "Verrouillage de la prise",
  "rcm": "Contrôleur de courant résiduel",
  "energyMeter": "Compteur d'énergie",
  "energyMeterThreePhases": "Compteur d'énergie triphasé",
  "auxInputs": "Entrée AUX",
  "auxOutputs": "Sortie AUX",
  "auxAnalogInputs": "Entrée analogique AUX",
  "serials": "Série",
  "maxChargingCurrent": "Courant de recharge max",
  "chargingCurrent": "Courant de recharge",
  "consumptionLimit": "Limite de consommation",
  "chargingTimeLimit": "Limite de temps de recharge",
  "underPowerLimit": "Limite de sous-alimentation",
  "requireAuth": "Nécessite une autorisation",
  "socketOutlet": "Prise de courant",
  "temperatureThreshold": "Seuil de température",
  "operatingTime": "Temps de fonctionnement",
  "breakTime": "Temps de pause",
  "retryCount": "Nombre de tentatives",
  "detection": "Détection",
  "unlockedHigh": "Déverrouillé haut",
  "lockedHigh": "Verrouillé haut",
  "mode": "Mode",
  "dummy": "Factice",
  "currentSensing": "Détection de courant",
  "currentAndVoltageSensing": "Détection de courant et tension",
  "acVoltage": "Tension AC",
  "threePhases": "Triphasé",
  "ssid": "SSID",
  "user": "Utilisateur",
  "password": "Mot de passe",
  "loading": "Chargement...",
  "uploading": "Teléversement...",
  "noWifiFound": "Aucun Wi-Fi trouvé",
  "systemLogs": "Journaux système",
  "modbus": "Modbus",
  "nextionDisplay": "Affichage Nextion",
  "script": "Script",
  "atCommands":"Commandes AT",
  "baudRate": "Débit en bauds",
  "dataBits": "Bits de données",
  "stopBits": "Bits d'arrêt",
  "parity": "Parité",
  "disable": "Désactiver",
  "even": "Paire",
  "odd": "Impaire",
  "tcpServer": "Serveur TCP",
  "unitId": "ID unité",
  "timezone": "Fuseau horaire",
  "time": "Heure",
  "setCurrent": "Définir le courant",
  "ntp": "NTP",
  "serverFromDhcp": "Serveur depuis DHCP",
  "server": "Serveur",
  "schedules": "Plannings",
  "noSchedules": "Aucun planning",
  "addSchedule": "Ajouter un horaire",
  "action": "Action",
  "enableCharging": "Activer la recharge",
  "chargerAvailable": "Chargeur disponible",
  "chargingCurrent6A": "Courant de recharge 6A",
  "chargingCurrent8A": "Courant de recharge 8A",
  "chargingCurrent10A": "Courant de recharge 10A",
  "clear": "Effacer",
  "remove": "Supprimer",
  "monday": "Lun",
  "tuesday": "Mar",
  "wednesday": "Mer",
  "thursday": "Jeu",
  "friday": "Ven",
  "saturday": "Sam",
  "sunday": "Dim",
  "root": "Racine",
  "name": "Nom",
  "size": "Taille",
  "download": "Télécharger",
  "edit": "Modifier",
  "_delete": "Supprimer",
  "emptyDirectory": "Le dossier est vide",
  "createDirectory": "Créer un répertoire",
  "createFile": "Créer un fichier",
  "uploadFile": "Envoyer un fichier",
  "fileName": "Nom du fichier",
  "directoryName": "Nom du répertoire",
  "fileContent": "Contenu du fichier",
  "fileSaved": "Fichier enregistré",
  "directorySaved": "Fichier enregistré",
  "fileDeleted": "Fichier supprimé",
  "directoryDeleted": "Répertoire supprimé",
  "fileUploaded": "Fichier envoyé avec succès",
  "fileTooLarge": "Le fichier sélectionné est trop volumineux",
  "components": "Composants",
  "noComponents": "Pas de composants",
  "configuration": "Configuration",
  "noComponentConfig": "Le composant n'a pas de configuration",
  "autoReload": "redémarrage automatique",
  "output": "Sortie",
  "restart": "Redémarrer",
  "confirmRestart": "Confimer le redémarrage?",
  "firmware": "Micrologiciel",
  "channel": "Canal",
  "checkForUpdate": "Vérifier les mises à jour",
  "upgradeTo": "Mettre à jour vers",
  "noUpdateAvailable": "Aucune mise à jour disponible",
  "uploadFirmware": "Envoyer le micrologiciel",
  "binariesFromReleases1": "utiliser les binaires depuis",
  "binariesFromReleases2": "versions",
  "writeFirmware": "Écrire le micrologiciel",
  "willBeRestart": "L'appareil va redémarrer",
  "reloadInSeconds1": "Rechargement dans",
  "reloadInSeconds2": "secondes",
  "reloadNow": "Recharger maintenant",
  "successfullyUpdatedFirmware": "Micrologiciel mis à jour avec succès",
  "successfullyUpdated": "Mis à jour avec succès",
  "scriptReloaded": "Script rechargé",
  "networkError": "Erreur réseau",
  "reloadPage": "Recharger la page",
  "model": "Modèle",
  "touch": "Tactile",
  "flashSize": "Taille mémoire flash",
  "noNextionConnected": "Aucun affichage Nextion connecté",
  "uploadProgram": "Téléverser le programme",
  "writeProgram": "Ecrire le programme",
  "staticIp": "Adresse IP statique",
  "gateway": "Passerelle",
  "netmask": "Masque de sous-réseau",
  "dns": "Serveur DNS",
  "wifiAccessPoint": "Point d'accès WiFi",
  "wifiAccessPointAutoStop": "Le point d'accès s'éteindra automatiquement si personne ne s'y connecte dans la minute.",
  "wifiStation": "Station WiFi",
  "discovery": "Découverte",
  "hostname": "Nom d'hôte",
  "instanceName": "Nom de l'instance",
  "rssi": "RSSI",
  "panicReboot": "Redémarrage panique",
  "acknowledge": "Acquitter",
  "successfullyAcknowledged": "Acquitté avec succès",
  "httpErrorValues": {
    "400": "Requête incorrecte",
    "404": "Non trouvé",
    "413": "Contenu trop volumineux",
    "415": "Type de média non supporté",
    "500": "Erreur interne du serveur",
    "512": "Échec d'allocation mémoire",
    "513": "Échec de réception de la requête",
    "520": "Impossible de récupérer les informations de la dernière version",
    "521": "Échec de la mise à jour du micrologiciel",
    "522": "Échec de réception du micrologiciel",
    "523": "Fichier de micrologiciel invalide",
    "531": "Échec de réception du fichier",
    "532": "Échec d'écriture du fichier"
  },
  "errorValues": {
    "pilot_fault": "Défaillance du pilote",
    "diode_short": "Court-circuit de la diode",
    "lock_fault": "Défaillance du verrouillage",
    "unlock_fault": "Défaillance du déverrouillage",
    "rcm_triggered": "RCM déclenché",
    "rcm_selftest_fault": "Défaillance de l'autotest du RCM",
    "temperature_high": "Température élevée",
    "temperature_fault": "Défaillance du capteur de température"
  },
  "energyMeterValues": {
    "cur_vlt": "Courant et tension",
    "cur": "Courant",
    "none": "Aucun"
  }
}